{
    "$id": "clinical_concept_schema",
    "$schema": "http://json-schema.org/draft-07/schema#",
    "title": "Clinical Concept",
    "type": "object",
    "required": [
        "codeString",
        "displayName"
    ],
    "additionalProperties": false,
    "properties": {
        "codeString": {
            "type": "string",
            "description": "The code (ex: LOINC, RxNorm) for this clinical concept."
        },
        "displayName": {
            "type": "string",
            "description": "The display name for this clinical concept, as returned by the FHIR server."
        },
        "showByDefault": {
            "description": "Whether this clinical concept should be displayed by default. False if unset.",
            "type": "boolean"
        },
        "displayBounds": {
            "type": "object",
            "required": [
                "lower",
                "upper"
            ],
            "properties": {
                "lower": {
                    "description": "Lower display bound for this concept. If unset, will be calculated based on data.",
                    "type": "number"
                },
                "upper": {
                    "description": "Upper display bound for this concept. If unset, will be calculated based on data.",
                    "type": "number"
                }
            }
        },
        "forceDisplayBounds": {
            "type": "boolean",
            "description": "Whether the display bounds should be forced even if the data is outside of them. No effect if displayBounds are unset. False if this is unset."
        },
        "groupName": {
            "type": "string",
            "description": "If set, this clinical concept will appear grouped with the same groupName. If unset, it will appear independently."
        },
        "innerComponentOnly": {
          "type": "boolean",
          "description": "If set, the ResourceCode for this component will be created, but it will not be displayed unless it is an inner component of another Resource."
        },
        "_comments": {
          "type": "string",
          "description": "Optional comments about the clinical concept"
        }
    }
}
