[
  {
    "codeString": "8310-5",
    "displayName": "Temperature",
    "showByDefault": true,
    "displayBounds": {
      "lower": 35,
      "upper": 41
    }
  },
  {
    "codeString": "8867-4",
    "displayName": "Heart Rate",
    "showByDefault": true,
    "displayBounds": {
      "lower": 20,
      "upper": 300
    }
  },
  {
    "codeString": "9279-1",
    "displayName": "Respiratory Rate",
    "showByDefault": true,
    "displayBounds": {
      "lower": 6,
      "upper": 100
    }
  },
  {
    "codeString": "59408-5",
    "displayName": "Oxygen Saturation (SpO2)",
    "showByDefault": true,
    "displayBounds": {
      "lower": 5,
      "upper": 100
    },
    "forceDisplayBounds": true
  },
  {
    "codeString": "8462-4",
    "displayName": "Diastolic Blood Pressure",
    "showByDefault": true,
    "displayBounds": {
      "lower": 25,
      "upper": 150
    }
  },
  {
    "codeString": "8480-6",
    "displayName": "Systolic Blood Pressure",
    "showByDefault": true,
    "displayBounds": {
      "lower": 30,
      "upper": 250
    }
  },
  {
    "codeString": "41904-4",
    "displayName": "Blood Pressure Location",
    "showByDefault": true,
    "groupNames": [
      "Blood Pressure Details"
    ]
  },
  {
    "codeString": "55284-4",
    "displayName": "Blood Pressure",
    "showByDefault": true,
    "groupNames": [
      "Blood Pressure"
    ]
  },
  {
    "codeString": "8478-0",
    "displayName": "Mean Arterial Pressure (Device)",
    "showByDefault": true,
    "displayBounds": {
      "lower": 25,
      "upper": 200
    },
    "groupNames": [
      "Blood Pressure"
    ]
  }
]